id,pali,target_word,class_source,class_sutta,class_example,english_translation
2603,attha 2.1,atthamhi,DHP 331,,<b>atthamhi</b> sah?y?,[Good are] friends in [arisen] need [Good are] friends when need [arises]
4036,anÄlaya 1,an?layo,TH 251,ra??hap?lattherag?th?,c?go pa?inissaggo <b>an?layo</b>,"The relinquishing, the abandonment, the non-attachment"
4524,anuttara,anuttaro,SN 55.7,ve?udv?reyyasutta?,itipi so bhagav? araha? samm?sambuddho vijj?cara?asampanno sugato lokavid? <b>anuttaro</b> purisadammas?rathi satth? devamanuss?na? buddho bhagav?’ti,"It is so (thus) “He [is] the Blessed One, the Worthy One, the fully Enlightened One, endowed with wisdom and ethical conduct, Fortunate One, knower of the world, incomparable leader of persons to be tamed, teacher of gods and humans, the Awakened One, the Blessed One.”"
6258,apara 1,aparena,MN 39,mah?assapurasutta?,<b>aparena</b> samayena buddho,"on another occasion, the Awakened One…"
6463,aparena samayena 1,aparena samayena,MN 39,mah?assapurasutta?,<b>aparena samayena</b> buddho,"on another occasion, the Awakened One…"
